<xs:schema xmlns:xs="http://www.w3.org/2001/XMLSchema">
    <xs:element name="student_details">
        <xs:complexType>
            <xs:sequence>
                <xs:element name="student" maxOccurs="unbounded">
                    <xs:complexType>
                        <xs:sequence>
                            <xs:element name="name">
                                <xs:complexType>
                                    <xs:sequence>
                                        <xs:element name="first_name" type="xs:string"/>
                                        <xs:element name="last_name" type="xs:string"/>
                                    </xs:sequence>
                                </xs:complexType>
                            </xs:element>
                            <xs:element name="registration_number" type="xs:string"/>
                            <xs:element name="department" type="xs:string"/>
                            <xs:element name="address" type="xs:string"/>
                            <xs:element name="phone_number">
                                <xs:simpleType>
                                    <xs:restriction base="xs:string">
                                        <xs:pattern value="\d{3}-\d{4}"/>
                                    </xs:restriction>
                                </xs:simpleType>
                            </xs:element>
                        </xs:sequence>
                    </xs:complexType>
                </xs:element>
            </xs:sequence>
        </xs:complexType>
    </xs:element>
</xs:schema>
